{
  "$schema": "https://json-schema.org/draft/2020-12/schema",
  "$id": "https://schemas.cyberwave.com/simulation.runtime_audit.v1.schema.json",
  "title": "Cyberwave Simulation Runtime Audit",
  "description": "What a running simulation plant reports about itself. ready is true only when the reported backend equals the requested backend, the execution profile and feature profile match the workload, the bundle/image digests match, and every required capability is 'ok' (first valid sample received). mismatches lists every reason it is not. See cyberwave_contracts.simulation.check_runtime_audit.",
  "type": "object",
  "additionalProperties": true,
  "required": [
    "contract",
    "workload_uuid",
    "run_id",
    "stream_instance_id",
    "requested_backend",
    "reported_backend",
    "execution_profile",
    "image_digest",
    "bundle_digest",
    "exporter_version",
    "extension_lock_digest",
    "physics",
    "gpu",
    "feature_profile_id",
    "capabilities",
    "ready",
    "mismatches"
  ],
  "properties": {
    "contract": {
      "const": "simulation.runtime_audit.v1"
    },
    "workload_uuid": {
      "type": "string"
    },
    "run_id": {
      "type": "string",
      "description": "Execution identity of this run; changes on every start."
    },
    "stream_instance_id": {
      "type": "string",
      "description": "Media/stream identity of this run."
    },
    "requested_backend": {
      "enum": [
        "mujoco",
        "mujoco_warp",
        "isaac"
      ]
    },
    "reported_backend": {
      "type": "string",
      "description": "Backend the runtime actually runs. A string, not the enum, so an unexpected value can be reported as a mismatch rather than rejected."
    },
    "requested_execution_profile": {
      "enum": [
        "isaac-cpu-physics",
        "isaac-gpu-physics",
        "isaac-newton-physics",
        null
      ]
    },
    "execution_profile": {
      "type": [
        "string",
        "null"
      ],
      "description": "Execution profile the runtime actually runs."
    },
    "image_digest": {
      "type": [
        "string",
        "null"
      ],
      "pattern": "^sha256:[0-9a-f]{64}$",
      "description": "Container image digest."
    },
    "bundle_digest": {
      "type": [
        "string",
        "null"
      ],
      "pattern": "^sha256:[0-9a-f]{64}$",
      "description": "Loaded scene bundle digest."
    },
    "exporter_version": {
      "type": [
        "string",
        "null"
      ]
    },
    "extension_lock_digest": {
      "type": [
        "string",
        "null"
      ],
      "pattern": "^sha256:[0-9a-f]{64}$"
    },
    "physics": {
      "type": "object",
      "additionalProperties": true,
      "required": [
        "engine",
        "variant",
        "device"
      ],
      "properties": {
        "engine": {
          "type": "string",
          "description": "Engine the runtime actually steps: physx or newton for isaac (see cyberwave_contracts.simulation.EXECUTION_PROFILE_PHYSICS), mujoco for the MuJoCo worker. A string, not an enum, so an unexpected engine is reported as a mismatch rather than rejected."
        },
        "variant": {
          "type": [
            "string",
            "null"
          ]
        },
        "device": {
          "enum": [
            "cpu",
            "gpu"
          ]
        }
      }
    },
    "gpu": {
      "type": [
        "object",
        "null"
      ],
      "additionalProperties": true,
      "required": [
        "name",
        "driver",
        "renderer"
      ],
      "properties": {
        "name": {
          "type": "string"
        },
        "driver": {
          "type": "string"
        },
        "renderer": {
          "type": [
            "string",
            "null"
          ]
        }
      }
    },
    "feature_profile_id": {
      "type": [
        "string",
        "null"
      ],
      "description": "profile_id@version of the implemented feature profile."
    },
    "capabilities": {
      "type": "object",
      "additionalProperties": {
        "enum": [
          "ok",
          "missing",
          "pending",
          "failed"
        ]
      },
      "description": "Capability (sensor id, modality or state stream) -> status."
    },
    "ready": {
      "type": "boolean"
    },
    "mismatches": {
      "type": "array",
      "items": {
        "$ref": "#/$defs/runtimeAuditMismatch"
      }
    },
    "error_code": {
      "type": [
        "string",
        "null"
      ],
      "description": "Stable error code when not ready, e.g. simulation_backend_runtime_mismatch."
    },
    "reported_at": {
      "type": [
        "string",
        "null"
      ],
      "description": "RFC 3339 UTC timestamp."
    }
  },
  "$defs": {
    "runtimeAuditMismatch": {
      "type": "object",
      "additionalProperties": true,
      "required": [
        "field",
        "expected",
        "reported"
      ],
      "properties": {
        "field": {
          "type": "string"
        },
        "expected": {
          "type": [
            "string",
            "null"
          ]
        },
        "reported": {
          "type": [
            "string",
            "null"
          ]
        },
        "code": {
          "type": [
            "string",
            "null"
          ]
        }
      }
    }
  }
}
